CLASSES,SENTENCES,PROVIDER,VALUE
DUTY,"You acknowledge that the Service is provided without any warranties of any kind whatsoever either express or implied, including but not limited to the implied warranties of merchantability and fitness for a particular purpose.",BetterPoints,3
DUTY,You acknowledge that use of the Service is fully at your own risk.,BetterPoints,3
PROHIBITION,"We do not represent or endorse the accuracy or reliability of any profile, advice, opinion, statement or other information displayed, uploaded or distributed through the Service by BetterPoints, our partners or any user of the Service or any other person or entity.",BetterPoints,2
DUTY,"You acknowledge that any reliance upon any such introduction, opinion, profile, advice, statement or information and any resulting participation or action shall be at your sole risk.",BetterPoints,3
PROHIBITION,"We do not represent or endorse the accuracy or reliability of any introduction, advice, opinion, statement or other information displayed, uploaded or distributed through the Service by BetterPoints or any user of the Service or any other service.",BetterPoints,2
DUTY,"Your continued use of the Service now, or following the posting of notice of any changes in this Agreement, will constitute a binding acceptance by you of this Agreement, or any subsequent modifications.",BetterPoints,3
PROHIBITION,"We do not make any representations, warranties or terms of any kind in respect of this website or its contents (including, without limitation, any views or comment made) other than those required by law.",BetterPoints,2
OTHERS,All information and/or data included in and/or on this Service is made available for guidance only.,BetterPoints,0
DUTY,Your use of such information and/or data is therefore entirely at your own risk.,BetterPoints,3
OTHERS,"The Service is distributed on an ""as is"" basis.",BetterPoints,0
OTHERS,We do not warrant that this Service will be uninterrupted or error-free.,BetterPoints,0
PERMISSION,"There may be delays, omissions, and interruptions in the availability of the Service.",BetterPoints,1
OTHERS,"We expressly exclude, to the fullest extent permitted by law, all liability of BetterPoints, its directors, employees or other representatives, howsoever arising, for any loss suffered as a result of your use of this Service or involvement in any way with BetterPoints.",BetterPoints,0
OTHERS,"Service Content, Opinions and Advice",BetterPoints,0
PROHIBITION,"The contents, including without limitation messages, commentary, blogs, news and advice, of the Service do not constitute advice and should not be relied upon in making or refraining from making any decision.",BetterPoints,2
PROHIBITION,"All content is provided for entertainment and/ or information purposes only, and is not intended, and should not be taken as specific advice in any particular circumstance.",BetterPoints,2
OTHERS,Modifications,BetterPoints,0
PERMISSION,We may modify this Agreement from time to time.,BetterPoints,1
OTHERS,"Notification of changes in this Agreement will be posted on the Service or sent via electronic mail, as we may determine in our sole discretion",BetterPoints,0
PROHIBITION," If you do not agree to any modifications, you should terminate your use of the Service.",BetterPoints,2
DUTY,"Your continued use of the Service now, or following the posting of notice of any changes in this Agreement, will constitute a binding acceptance by you of this Agreement, or any subsequent modifications.",BetterPoints,3
OTHERS,Disclosure and Other Communication,BetterPoints,0
PERMISSION,We reserve the right to use the information about your usage of the Service and demographics in forms that do not reveal your personal identity.,BetterPoints,1
PERMISSION,"And by your use of the Service, you consent to such disclosures and communications subject to the terms of our Privacy Statement.",BetterPoints,1
OTHERS,Governing Law,BetterPoints,0
OTHERS,This policy and consent forms part of our Service terms of use and as such it shall be governed by and construed in accordance with the laws of England and Wales.,BetterPoints,0
DUTY,"You irrevocably agree that the courts of England and Wales shall have exclusive jurisdiction to resolve any dispute or claim of whatever nature arising out of or relating to this policy and consent or otherwise to the use of your personal data, and that the laws of England and Wales shall govern such dispute or claim.",BetterPoints,3
PERMISSION,"However, we retain the right to bring legal proceedings in any jurisdiction where we believe that infringement of our intellectual property rights or breach of those terms is taking place or originating.",BetterPoints,1
DUTY,You are responsible for compliance with any applicable laws and regulations of the jurisdiction from which you are accessing this Service.,BetterPoints,3
OTHERS,Assignment,BetterPoints,0
PROHIBITION,You do not have the right to assign this Agreement or any of your rights to the Service to anyone.,BetterPoints,2
PERMISSION,BetterPoints has the right to assign any or all of its rights and duties under this Agreement or to the Service to any third party.,BetterPoints,1
OTHERS,"At the election of BetterPoints, if BetterPoints’ obligations hereunder are assumed by a third party, BetterPoints shall be relieved of any and all liability under this Agreement.",BetterPoints,0
OTHERS,Company Registered Address,BetterPoints,0
OTHERS,"BetterPoints Ltd, 3 The Mount, Trumpsgreen Road, Virginia Water, Surrey, GU25 4EJ, United Kingdom.",BetterPoints,0
OTHERS,BetterPoints Ltd is registered in England and Wales No: 7356214.,BetterPoints,0
OTHERS,Welcome to Box!,Box,0
OTHERS,Box is a cloud-based content management platform.,Box,0
OTHERS,"Our products make it easier for people to share ideas, collaborate and help get work done.",Box,0
PERMISSION,"Since our products are cloud based, you can access them through the web and through any number of device types (e.g., desktop, laptop, tablets, and smartphone devices) that you choose.",Box,1
OTHERS,"This document, the Box Terms of Service (""Terms""), outlines the terms regarding your use of our products.",Box,0
OTHERS,These Terms are a legally binding contract between you and Box so please read carefully.,Box,0
PROHIBITION,"If you do not agree with these Terms, do not register or use any of the Services.",Box,2
DUTY,"By using, accessing or browsing the Box Service, platform and products including applications, mobile, software, websites or other properties owned or operated by Box or by registering for a Box account ( ""Services"") you are agreeing to be bound by these Terms for the Services provided by Box (""Box"" or ""we"").",Box,3
OTHERS,"If you reside in the United States, you are entering into this contract with Box, Inc.",Box,0
OTHERS,"If you reside outside of the United States excluding Japan, you are entering into this contract with Box.com (UK) Ltd., a company registered in England and Wales (company number 0809736), VAT number GB177912768.",Box,0
OTHERS,"If you reside in Japan, you are entering into this contract with K.K. Box Japan, a company registered in Japan (company number 0104-01-107327).",Box,0
DUTY,"If you are using the Services on behalf of an organization, you are agreeing to these Terms for that organization and promising to Box that you have the authority to bind that organization to these Terms (in which event, ""you"" and ""your"" will refer to that organization) unless that organization has a separate paid contract in effect with us, in which event the terms of that contract will govern your use of the Services.",Box,3
DUTY,"In order to use the Service, you must be legally permitted to accept these Terms.",Box,3
OTHERS,PRIVACY,Box,0
OTHERS,"In order to operate and provide the Services, we collect certain information about you.",Box,0
OTHERS,We use and protect that information as described in our Privacy Policy.,Box,0
DUTY,"You acknowledge your use of the Services is subject to our Privacy Policy and understand that it identifies how Box collects, stores, and uses certain information.",Box,3
OTHERS,CHANGES TO THESE TERMS,Box,0
PERMISSION,We reserve the right to modify these Terms.,Box,1
OTHERS,"We will post the most current version of these Terms at www.box.com (the ""Site"").",Box,0
OTHERS,"If we make material changes to these Terms, we will notify you via the Services and/or by email to the address associated with your account.",Box,0
PROHIBITION,"If you do not accept the changes, you must stop using and cancel your account by emailing cancel@box.com.",Box,2
PERMISSION,Your continued use of our Services after we publish or send a notice about our changes to these Terms means that you are consenting to the updated terms.,Box,1
OTHERS,YOUR ACCOUNT,Box,0
DUTY,Certain aspects of the Services may require you to obtain an account by completing a registration form and designating a user ID and password.,Box,3
DUTY,"When registering with Box you must: (a) provide true, current and complete information about yourself on the registration form and (b) maintain such information so it continues to be true, current and complete.",Box,3
DUTY,"You are entirely responsible for all materials and information that you upload, post or otherwise transmit via the Services (please also see our Acceptable Use Policy in Section 10).",Box,3
PERMISSION,"If your account includes an administrative console, that console may include options to configure your use of some of the features in the Box Services.",Box,1
DUTY,"If you choose to use Box Sign, the electronic signing feature Box may make available to you as part of the Box Services (""Box Sign""), it is your responsibility to determine whether the features of Box Sign are appropriate for your particular use cases and the laws and regulations that apply to you and the signers of your documents.",Box,3
OTHERS,"If you use Box Sign, it will present this default disclosure to each recipient of your Box Sign requests on your behalf unless you have an administrative console and have changed the disclosure settings in that console.",Box,0
DUTY,"By using Box Sign to send files for signature without changing the default disclosure settings, you are adopting this disclosure each time as terms that will govern your Box Sign transaction.",Box,3
OTHERS,"Similarly if you customize the disclosure in your administrative console, the customized terms you create will be presented to each recipient of your Box Sign requests and will govern each of your Box Sign transactions.",Box,0
DUTY,Only you may use your Box account and you are responsible for all aspects of your account.,Box,3
DUTY,Each user must have a separate account.,Box,3
PROHIBITION,"You may not share, loan or transfer your ID or password.",Box,2
OTHERS,"If you become aware of any unauthorized use of the Services or your account, or have any questions about your account please contact Box Support via our Box Community Page.",Box,0
OTHERS,4. EMAIL SELECTED FOR YOUR ACCOUNT,Box,0
PERMISSION,You get to choose what email address(es) you register for an account.,Box,1
PERMISSION,"Please be aware, however, that if the domain of the email address associated with your account is owned or controlled by an organization (such as your work or school) and that organization establishes a direct relationship with us and wishes to add your account to such relationship, then you may be rolled into that organization's account after a reasonable attempt to notify you of the change.",Box,1
OTHERS,"Fourteen (14) days after that attempted notice, if you do not respond or change the email address associated with your account, your account may be deactivated, and Content associated with your account may be deleted.",Box,0
DUTY,"If an organization provided you with your account (e.g., an employer or school), or if you agree to have your account managed by an organization, you understand that this organization has rights to your account and may: (a) manage your account (including suspending or canceling); (b) reset your password; (c) view your usage and profile data, including how and when your account is used; and (d) manage the Content in your account.",Box,3
OTHERS,5. CONSENT TO ELECTRONIC COMMUNICATIONS AND SOLICITATION,Box,0
PERMISSION,"By registering with Box or signing up for Services, you understand and consent to us sending you (including via email) information regarding the Services, such as: (a) notices about your use of the Services, including notices of violations of use; (b) updates to the Services and new features or products; (c) administrative messages and other information; and (d) advertising, marketing, and other materials regarding Box's products and services.",Box,1
PERMISSION,Please review your settings in your account to control the messages you receive from us or you may choose to opt-out of receiving advertising and marketing materials by unsubscribing from such communications by following the instructions in the message.,Box,1
OTHERS,Notices emailed to you will be considered given and received when the email is sent.,Box,0
PROHIBITION,"If you do not consent to receive notices (other than advertising and marketing materials) electronically, you must stop using the Services.",Box,2
OTHERS,CONTENT,Box,0
OTHERS,"We call all the electronic documents that you upload and store on your account ""Content"".",Box,0
OTHERS,All Content uploaded by you into your account is yours!,Box,0
PROHIBITION,"We don't control, verify, or endorse the Content that you or others put on the Services.",Box,2
DUTY,You are responsible for: (a) all Content in your Box account(s) and that you share through the Services-and (b) making sure that you have all the rights you need in relation to the Content.,Box,3
PROHIBITION,"In addition, by storing, using or transmitting Content you confirm that you will not violate any law or these Terms (please also see the Acceptable Use Policy in Section 10).",Box,2
DUTY,"You agree that when you share your Content, you may be allowing other people to access and use your Content in any way without further restriction or compensation to you.",Box,3
DUTY,"You agree to provide Box (as well as agents or service providers acting on Box's behalf to provide the Services) the right to transmit, process, use and disclose Content and other information which we may obtain as part of your use of the Services but only: (i) as necessary for us to provide the Services, (ii) as otherwise permitted by these Terms, (iii) as otherwise required by law, regulation or order, and/or (iv) to respond to an emergency.",Box,3
OTHERS,COPYRIGHT COMPLAINTS AND REMOVAL POLICY,Box,0
DUTY,Box respects the intellectual property of others and will respond to notices of alleged copyright infringement that comply with the law.,Box,3
PERMISSION,We reserve the right to delete or disable Content alleged to violate copyright laws or these Terms and reserve the right to terminate the account(s) of violators.,Box,1
OTHERS,"If you believe there has been a violation of your intellectual property rights, please complete our copyright compliant form; which can also be found here: https://cloud.app.box.com/copyright.",Box,0
OTHERS,"Or contact our designated copyright agent by mail: Attn: Copyright Agent, Box, Inc., 900 Jefferson Avenue, Redwood City, CA 94063 USA",Box,0
OTHERS,CONFIDENTIAL INFORMATION,Box,0
PERMISSION,"During your use of the Services, Box may share with you information that is confidential, sensitive or should be kept secret.",Box,1
OTHERS,"For example, if we tell you about our product roadmaps, product designs and architecture, technology and technical information, provide you with security audit reviews, business and marketing plans, or share with you our business processes, these should always be considered confidential to Box.",Box,0
DUTY,"Similarly, we agree that your Content, credit card/banking information and information contained in your account is confidential to you.",Box,3
OTHERS,"Also, if either of us provide any documents to the other that are labeled ""confidential"" (or something similar), or provide information (either in writing or verbal) that is of a type that a reasonable person should understand to be confidential such information is to be treated as confidential information.",Box,0
OTHERS,"However, if you tell us information that: (a) we already know at the time you tell us; (b) was told to us by a third party who had the right to tell us; (c) is generally available to the public; or (d) was independently developed by us without using any of your confidential information, then that information will not be considered confidential.",Box,0
OTHERS,The same goes for information that we tell you that falls into any of these categories.,Box,0
DUTY,"Lastly, we both agree that: (i) we will treat each other's information with the same degree of care that we treat our own confidential information; (ii) will use each other's confidential information only in connection with these Terms and the Services; (iii) only share the information with others who have a need to know and who have agreed in writing to treat it as confidential (as we've outlined in this section); and (iv) not share the information with any third party except as allowed in these Terms or through the Services.",Box,3
OTHERS,"Of course, confidential information will always remain the property of its owner.",Box,0
OTHERS,CONTENT STORAGE,Box,0
OTHERS,The Services are provided from the United States.,Box,0
DUTY,"By using and accessing the Services, you understand and agree to the storage of Content and any other personal information in the United States.",Box,3
PERMISSION,"However, you understand that you (or other people that you collaborate with) can access the Services (including Content) from outside of the United States (subject to applicable law) and that nothing prohibits the processing of other information outside of the United States.",Box,1
OTHERS,Box does offer products that enable storage and/or processing of Content outside of the United States and those products are subject to the Box Zones specific terms in Section 26.,Box,0
OTHERS,ACCEPTABLE USE POLICY,Box,0
PROHIBITION,"You agree you will not, nor will you encourage others or assist others to, harm the Services or use the Services to harm others.",Box,2
PROHIBITION,"for example, you must not use the Services to harm, threaten, or harass another person, organization or Box and/or to build a similar service or website.",Box,2
PROHIBITION,"You must not: (a) damage, disable, overburden, or impair the Service (or any network connected to the Services); (b) resell or redistribute the Services or any part of it; (c) use any unauthorized means to modify, reroute, or gain access to the Services or attempt to carry out these activities; (d) use any automated process or service (such as a bot, a spider, or periodic caching of information stored by Box) to access or use the Services; (e) use the Services beyond the features allocation and amounts provided in that Service or in violation of our fair use policy; (f) use the Services to, and/or cause Box to, violate any law or distribute any malware or malicious Content; (g) use the Box Service to communicate any message or material that is defamatory, harassing, libelous, threatening, or obscene; (h) use the Box Service in a way that violates or infringes upon the intellectual property rights or the privacy or publicity rights of any person or entity; (i) distribute, post, share information or Content illegally or without permission; (j) use the Box Service to disseminate or promote terrorism or terrorist activities; or (k) use the Box Service to disseminate material that may infringe upon legally protected social rights and freedoms of a person(s) (collectively, 'human rights') and/or as defined by domestic and public international laws and/or other legal norms.",Box,2
PERMISSION,"As part of our efforts to protect the Service, protect our customers, or to stop you from breaching these Terms we retain the right to block or otherwise prevent delivery of any type of file, email or other communication to or from the Services.",Box,1
PERMISSION,"We also reserve the right to deactivate, change and/or require you to change your Box user ID and any custom or vanity URLs, custom links, or vanity domains you may obtain through the Services.",Box,1
DUTY,"You also agree that if you learn of any unauthorized or unacceptable use of any account, Content or the Service, you will promptly contact Box Support and take all reasonable steps to cooperate with Box and assist in the termination of such use.",Box,3
OTHERS,SUSPENSION AND TERMINATION OF THE SERVICE,Box,0
PERMISSION,We reserve the right to suspend or terminate your access to the Service at any time in our sole discretion or disable any Content if a) you are in breach of these Terms; or b) your use of the Services could cause a risk of harm or loss to Box or our other users; or c) Box declines to renew your Subscription Period.,Box,1
PERMISSION,"When reasonable and as permitted by law, Box will provide you reasonable advance notice of this change as well as an opportunity to correct any actions that led to Box's decision.",Box,1
PROHIBITION,"We will not be able to provide this advance notice if you are in material breach of these Terms, or if such notice would lead to civil or criminal liability for Box, or if providing notice would compromise our ability to provide the Services to our other users.",Box,2
PERMISSION,"For the avoidance of doubt, Box may still make a determination that it does not want to continue offering you access to the Service at any time for any or no reason.",Box,1
PROHIBITION,"You understand that if your account is suspended or terminated, you may no longer have access to the Content that is stored with the Services.",Box,2
PERMISSION,"Upon termination you may request access to your Content, which we will make available, except in cases where we have terminated your account due",Box,1
DUTY,"You must make such request within fourteen (14) days following termination otherwise, any Content you have stored with the Services may not be retrievable and we will have no obligation to maintain Content stored in your account after this fourteen (14) day period.",Box,3
OTHERS,o your violation of these Terms or the Acceptable Use Policy terms in Section 10.,Box,0
OTHERS,UPDATES TO THE SERVICE,Box,0
PERMISSION,"Box may make deployments of changes, updates or enhancements to the Services or modifications to Box's default settings at any time.",Box,1
PERMISSION,"We may also add or remove functionalities or features, or we may suspend or stop the Services altogether.",Box,1
OTHERS,THIRD PARTY PRODUCTS,Box,0
PERMISSION,"Box may make available to you optional third-party applications, services or products, for use in connection with the Services (""Third-Party Products"").",Box,1
OTHERS,"These Third-Party Products are not necessary for the use of the Services and your use of the Third-Party Products (and any exchange of any information, license, payments etc.) is solely between you and the applicable third-party provider.",Box,0
OTHERS,Box makes no warranties of any kind and assumes no liability of any kind for your use of such Third-Party Products.,Box,0
OTHERS,"If you have any questions or concerns regarding the Third-Party Products, then please contact the applicable third-party provider.",Box,0
OTHERS,BOX PROPRIETARY RIGHTS,Box,0
OTHERS,"All contents of the Site and Services including but not limited to logo, design, text, software, technical drawings, configurations, graphics, other files, and their selection and arrangement and Box Confidential Information belong to Box, and/or its suppliers, affiliates, or licensors.",Box,0
PERMISSION,"Box or its licensors own and reserve all rights, title and interest in and to the Services and all hardware, software and other items used to provide the Services, other than the rights we expressly grant to you to use the Services and Box Confidential Information.",Box,1
OTHERS,No title to or ownership of any proprietary rights related to the Services or Box Confidential Information is transferred to you pursuant to these Terms.,Box,0
PERMISSION,"If you provide comments, suggestions and recommendations to Box about a Service (e.g., modifications, enhancements, improvements) (collectively, ""Feedback""), you are automatically assigning this Feedback to Box.",Box,1
OTHERS,NO WARRANTY OR CONDITIONS,Box,0
OTHERS,There are certain things that we do not promise about the Services.,Box,0
OTHERS,"Other than as expressly stated, we do not make any commitments about the specific functionality available through the Services, their reliability, availability, or ability to meet your needs.",Box,0
OTHERS,"TO THE EXTENT NOT PROHIBITED BY LAW, BOX AND ITS AFFILIATES (AND ASSOCIATED SERVICE PROVIDERS) (A) PROVIDE THE SERVICES ""AS IS"", ""WITH ALL FAULTS"" AND ""AS AVAILABLE"", (B) MAKE NO REPRESENTATIONS OR WARRANTIES OR CONDITIONS WHETHER EXPRESS OR IMPLIED (E.G. WARRANTY OF MERCHANTABILITY, SATISFACTORY QUALITY, FITNESS FOR A PARTICULAR PURPOSE, OR NON-INFRINGEMENT), AND (C) DO NOT GUARANTEE THAT THE SERVICES WILL BE UNINTERRUPTED, ERROR-FREE OR FREE OF HARMFUL COMPONENTS, OR THAT THE CONTENT WILL BE SECURE OR NOT OTHERWISE LOST OR DAMAGED.",Box,0
OTHERS,"IF YOU ARE DISSATISFIED WITH ANY PORTION OF THE SERVICE OR WITH THESE TERMS OF SERVICE, YOUR SOLE AND EXCLUSIVE REMEDY IS TO DISCONTINUE USE OF THE SERVICES.",Box,0
OTHERS,INDEMNIFICATION,Box,0
