CLASSES,SENTENCES,PROVIDER,VALUE
PERMISSION,"If a product is not permitted to be possessed, sold, purchased, exported, imported or manufactured in one or more country/regions, Sites reserve the right to remove the listing of such product from, OR STOP THE SALE OF ANY SUCH PRODUCT IN, those country/regions.",Alibaba,1
PROHIBITION,"If, at any time, you fail to meet any of the above requirements, you should stop using the Services immediately.",Alibaba,2
PERMISSION,"If Alibaba.com reasonably believes that any of your conduct violates or threatens to violate any applicable laws and regulations, Alibaba.com may, at its sole discretion, at any time take action as it may deem appropriate in light of the circumstances, including, but not limited to, terminating the provision of Services to you, closing relevant purchase orders, and terminating your accounts, while reserving all rights it may have regarding any non-compliant actions or conduct of its members.",Alibaba,1
OTHERS,Breaches by Members,Alibaba,0
PERMISSION,"Alibaba.com reserves the right in our sole discretion to remove, modify or reject any User Content (in whole or in part) that you submit to, post or display on the Sites which we reasonably believe (i) violates any applicable laws and regulations, (ii) violates the Terms hereunder, (iii) could subject Alibaba.com or our affiliates to liability, (iv) infringes any Third Party Rights, (v) could harm the interests of our Members, third party or Alibaba.com or our affiliates, or (vi) is otherwise found inappropriate in Alibaba.com’s sole discretion.",Alibaba,1
PERMISSION,"If any Member breaches any Terms, or if Alibaba.com has reasonable grounds to believe that a Member is in breach of any Terms, Alibaba.com shall have the right to take such disciplinary actions as it deems appropriate, including without limitation: (i) suspending or terminating the Member’s account and any and all accounts determined to be related to such account by Alibaba.com in its sole discretion without liability for any losses or damages arising out of or in connection with such suspension or termination; (ii) restricting, downgrading, suspending or terminating the subscription of, access to, or current or future use of any Service; (iii) removing any product listings or other User Content that the Member has submitted, posted or displayed, or imposing restrictions on the number of product listings or User Content that the Member may post or display; (iv) imposing other restrictions on the Member’s use of any features or functions of any Service as Alibaba.com may consider appropriate in its sole discretion; and (v) any other corrective actions, discipline or penalties as Alibaba.com may deem necessary or appropriate in its sole discretion.",Alibaba,1
OTHERS,"Without limiting the generality of the provisions of the Terms, a Member would be considered as being in breach of the Terms in any of the following circumstances: a) upon complaint or claim from any third party, Alibaba.com has reasonable grounds to believe that such Member has willfully or materially failed to perform your contract with such third party including without limitation where a Member who supplies products or services using the Sites and Services has failed to deliver any items ordered by such third party after receipt of the purchase price, or where the items such Member has delivered materially fail to meet the terms and descriptions outlined in your contract with such third party, b) Alibaba.com has reasonable grounds to suspect that such Member has used a stolen credit card or other false or misleading information in any transaction with a counter party, c) Alibaba.com has reasonable grounds to suspect that any information provided by the Member is not current or complete or is untrue, inaccurate, or misleading, or d) Alibaba.com believes that the Member’s actions may cause financial loss or legal liability to Alibaba.com or our affiliates or any other Users.",Alibaba,0
PERMISSION,"Alibaba.com reserves the right to cooperate fully with governmental or regulatory authorities, law enforcement bodies, private investigators and/or injured third parties in the investigation of any suspected criminal or civil wrongdoing.",Alibaba,1
PERMISSION,"Further, to the extent permitted by applicable laws and policies, Alibaba.com may disclose the Member's identity, contact information and/or information regarding the Member's account(s), transactions or activities carried out on or via the Site, if requested by a government, regulatory or law enforcement body or an injured third party, or as a result of a subpoena or other legal action.",Alibaba,1
PROHIBITION,"Alibaba.com shall not be liable for damages or results arising from such disclosure, and Member agrees not to bring any action or claim against Alibaba.com for such disclosure.",Alibaba,2
PERMISSION,"Alibaba.com may, at any time and in our reasonable discretion, impose limitations on, suspend or terminate the Member’s use of any Service or the Sites without being liable to the Member if Alibaba.com has received notice that the Member is in breach of any agreement or undertaking with any affiliate of Alibaba.com including without limitation Taobao, Alipay, China Yahoo! and such breach involves or is reasonably suspected to involve dishonest or fraudulent activities.",Alibaba,1
PERMISSION,"Alibaba.com reserves the right to, but shall not be required to investigate such breach or request confirmation from the Member.",Alibaba,1
DUTY,"Each Member agrees to indemnify Alibaba.com, our affiliates, directors, employees, agents and representatives and to hold them harmless, from any and all damages, losses, claims and liabilities (including legal costs on a full indemnity basis) which may arise from your submission, posting or display of any User Content, from your access to or use of the Sites or Services, or from your breach of the Terms or any Additional Agreements.",Alibaba,3
DUTY,"Each Member further agrees that Alibaba.com is not responsible, and shall have no liability to you or anyone else for any User Content or other material transmitted through the Sites or Services, including fraudulent, untrue, misleading, inaccurate, defamatory, offensive or illicit material and that the risk of damage from such User Content or other material rests entirely with the Member.",Alibaba,3
PERMISSION,"Alibaba.com reserves the right, at our own expense, to assume the exclusive defense and control of any matter otherwise subject to indemnification by the Member, in which event the Member shall cooperate with Alibaba.com in asserting any available defenses.",Alibaba,1
OTHERS,Transactions Between Buyers and Sellers,Alibaba,0
OTHERS,"Through the Sites, Alibaba.com provides electronic web-based platforms for exchanging information between buyers and sellers of products and services.",Alibaba,0
OTHERS,"Alibaba.com additionally provides electronic web-based transaction platforms for Members to place, accept, conclude, manage and fulfill orders for the provision of products and services online within the Sites subject to the terms of the Transaction Services Agreement.",Alibaba,0
OTHERS,"However, for any Services, Alibaba.com does not represent either the seller or the buyer in specific transactions.",Alibaba,0
OTHERS,"Alibaba.com does not control and is not liable or responsible for the quality, safety, lawfulness or availability of the products or services offered for sale on the Sites, the ability of the sellers to complete a sale or the ability of buyers to complete a purchase.",Alibaba,0
DUTY,Users are hereby made aware that there may be risks of dealing with people acting under false pretenses.,Alibaba,3
OTHERS,Alibaba.com uses several techniques to verify the accuracy of certain information our paying Users provide us when they register for a paying membership service on the Sites.,Alibaba,0
OTHERS,"However, because user verification on the Internet is difficult, Alibaba.com cannot and does not confirm each User's purported identity (including, without limitation, paying Members).",Alibaba,0
OTHERS,"We encourage you to use various means, as well as common sense, to evaluate with whom you are dealing.",Alibaba,0
DUTY,Buyers and sellers accessing or using the Sites or Services shall assume the risks of conducting any purchase and sale transactions in connection with or through the Sites or Services. Buyer and sellers accessing or using the Site or Services shall also fully assume all risks of liability or harm of any kind arising out of or in connection with any subsequent activity relating to the products or services that are the subject of the transactions on the Sites.,Alibaba,3
OTHERS,"Examples of such risks shall include, but are not limited to, mis-representation of products and services, fraudulent schemes, unsatisfactory product quality, failure to meet specifications, defective or dangerous products, unlawful products, delay or default in delivery or payment, cost mis-calculations, breach of warranty, breach of contract, transportation accidents, the risk that the manufacture, importation, export, distribution, offer, display, purchase, sale and/or use of products or services offered or displayed on the Sites may violate or may be asserted to violate Third Party Rights, and the risk that Users may incur costs of defense or other costs in connection with third parties’ assertion of Third Party Rights, or in connection with any claims by any party that they are entitled to defense or indemnification in relation to the assertion of rights, demands or claims by claimants of Third Party Rights.",Alibaba,0
OTHERS,"Examples of such risks also include the risk of claims from consumers, other purchasers, end-users of products or other third parties that they have suffered injuries or harm from their use of the products obtained through the Sites or Services.",Alibaba,0
OTHERS,"All of the foregoing risks are referred to as ""Transaction Risks"".",Alibaba,0
OTHERS,"Alibaba.com is not liable or responsible for any damages, claims, liabilities, costs, harm, inconveniences, business disruptions or expenditures of any kind that may arise a result of or in connection with any Transaction Risks.",Alibaba,0
DUTY,"Buyers and sellers on the Sites are solely responsible for setting out and performance of the terms and conditions of the transactions conducted on, through or as a result of use of the Sites or Services, including, without limitation, terms regarding payment, returns, warranties, shipping, insurance, fees, taxes, title, licenses, fines, permits, handling, transportation and storage, subject to any additional obligations imposed under the Transaction Services Agreement(and in particular, clause 3.2).",Alibaba,3
DUTY,"User agrees to provide all information and materials as may be reasonably required by Alibaba.com in connection with your transactions conducted on, through or as a result of use of the Sites or Services.",Alibaba,3
PERMISSION,Alibaba.com has the right to suspend or terminate any User’s account if the User fails to provide the required information and materials without liability for any losses or damages arising out of or in connection with such suspension or termination.,Alibaba,1
DUTY,"In the event that any User has a dispute with any party to a transaction, such User agrees to release and indemnify Alibaba.com (and our agents, affiliates, directors, officers and employees) from all claims, demands, actions, proceedings, costs, expenses and damages (including without limitation any actual, special, incidental or consequential damages) arising out of or in connection with such dispute or the transaction.",Alibaba,3
OTHERS,Limitation of Liability,Alibaba,0
OTHERS,"TO THE MAXIMUM EXTENT PERMITTED BY LAW, THE SERVICES PROVIDED BY ALIBABA.COM ON OR THROUGH THE SITES ARE PROVIDED ""AS IS"", ""AS AVAILABLE"" AND “WITH ALL FAULTS”, AND ALIBABA.COM HEREBY EXPRESSLY DISCLAIMS ANY AND ALL WARRANTIES, EXPRESS OR IMPLIED, INCLUDING BUT NOT LIMITED TO, ANY WARRANTIES OF CONDITION, QUALITY, DURABILITY, PERFORMANCE, ACCURACY, RELIABILITY, MERCHANTABILITY OR FITNESS FOR A PARTICULAR PURPOSE.",Alibaba,0
OTHERS,"ALL SUCH WARRANTIES, REPRESENTATIONS, CONDITIONS, AND UNDERTAKINGS ARE HEREBY EXCLUDED.",Alibaba,0
OTHERS,"TO THE MAXIMUM EXTENT PERMITTED BY LAW, ALIBABA.COM MAKES NO REPRESENTATIONS OR WARRANTIES ABOUT THE VALIDITY, ACCURACY, CORRECTNESS, RELIABILITY, QUALITY, STABILITY, COMPLETENESS OR CURRENTNESS OF ANY INFORMATION PROVIDED ON OR THROUGH THE SITES; ALIBABA.COM DOES NOT REPRESENT OR WARRANT THAT THE MANUFACTURE, IMPORTATION, EXPORT, DISTRIBUTION, OFFER, DISPLAY, PURCHASE, SALE AND/OR USE OF PRODUCTS OR SERVICES OFFERED OR DISPLAYED ON THE SITES DOES NOT VIOLATE ANY THIRD PARTY RIGHTS; AND ALIBABA.COM MAKES NO REPRESENTATIONS OR WARRANTIES OF ANY KIND CONCERNING ANY PRODUCT OR SERVICE OFFERED OR DISPLAYED ON THE SITES.",Alibaba,0
DUTY,Any material downloaded or otherwise obtained through the Sites or Services is done at each User's sole discretion and risk and each User is solely responsible for any damage to its own or to Alibaba.com’s computer system(s) or any loss of data that may result from the download of any such material.,Alibaba,3
OTHERS,"No advice or information, whether oral or written, obtained by any User from Alibaba.com or through or from the Sites shall create any warranty not expressly stated herein.",Alibaba,0
PERMISSION,The Sites may make available to User services or products provided by independent third parties.,Alibaba,1
OTHERS,No warranty or representation is made with regard to such services or products.,Alibaba,0
OTHERS,In no event shall Alibaba.com or our affiliates be held liable for any such services or products.,Alibaba,0
DUTY,"Each User hereby agrees to indemnify and hold Alibaba.com, our affiliates, directors, officers and employees harmless, from any and all losses, claims, liabilities (including legal costs on a full indemnity basis) which may arise from such User's access to or use of the Sites or Services (including but not limited to the submission, posting or display of such User's information and User Content on the Sites, Alibaba Channels or Third Party Channels under Promotion Services) or from your breach of any of the representations, warranties hereunder and the terms and conditions of the Terms. Each User hereby further agrees to indemnify and hold Alibaba.com, our affiliates, directors, officers and employees harmless, from any and all losses, damages, claims, liabilities (including legal costs on a full indemnity basis) which may arise from User's breach of any representations and warranties made by User to Alibaba.com, including but not limited to those set forth in clause 5 hereunder.",Alibaba,3
DUTY,"Each User hereby further agrees to indemnify and save Alibaba.com, our affiliates, directors, officers and employees harmless, from any and all losses, damages, claims, liabilities (including legal costs on a full indemnity basis) which may arise, directly or indirectly, as a result of any claims asserted by Third Party Rights claimants or other third parties relating to the User Content, information and/or products offered or displayed on the Sites.",Alibaba,3
DUTY,"Each User hereby further agrees that Alibaba.com is not responsible and shall have no liability to you, for any material posted by others, including defamatory, offensive or illicit material and that the risk of damages from such material rests entirely with each User.",Alibaba,3
PERMISSION,"Alibaba.com reserves the right, at our own expense, to assume the exclusive defense and control of any matter otherwise subject to indemnification by you, in which event you shall cooperate with Alibaba.com in asserting any available defenses.",Alibaba,1
OTHERS,"Alibaba.com shall not be liable for any special, direct, indirect, punitive, incidental or consequential damages or any damages whatsoever (including but not limited to damages for loss of profits or savings, business interruption, loss of information), whether in contract, negligence, tort, equity or otherwise or any other damages resulting from any of the following: a) the use or the inability to use the Sites or Services; b) any defect in goods, samples, data, information or services purchased or obtained from a User or any other third party through the Sites or Services; c) violation of Third Party Rights or claims or demands that User's manufacture, importation, exportation, distribution, offer, display, purchase, sale and/or use of products or services offered or displayed on the Sites or through the Services may violate or may be asserted to violate Third Party Rights; or claims by any party that they are entitled to defense or indemnification in relation to assertions of rights, demands or claims by Third Party Rights claimants; d) unauthorized access by third parties to data or private information of any User; e) statements or conduct of any User of the Sites or Services; or; f) any matters relating to the Sites or Services, however arising, including negligence.",Alibaba,0
OTHERS,"Notwithstanding any of the foregoing provisions, the aggregate liability of Alibaba.com, our employees, agents, affiliates, representatives or anyone acting on our behalf with respect to each User for all claims arising from the access to or use of the Sites or Services during any calendar year shall be limited to the greater of (a) the amount of fees the User has paid to Alibaba.com in exchange for the access to or use of the Site or Services during the calendar year and (b) the maximum amount permitted under the applicable law.",Alibaba,0
OTHERS,The preceding sentence shall not preclude the requirement by the User to prove actual damages.,Alibaba,0
DUTY,All claims arising from the use of the Sites or Services must be filed within one (1) year from the date the cause of action arose or such longer period as prescribed under the applicable law governing the Terms.,Alibaba,3
OTHERS,The limitations and exclusions of liability to you under the Terms shall apply to the maximum extent permitted by law and shall apply whether or not Alibaba.com has been advised of or should have been aware of the possibility of any such losses arising.,Alibaba,0
OTHERS,Force Majeure,Alibaba,0
OTHERS,"Alibaba.com shall not be liable for or required to pay compensation of any nature whatsoever for any loss arising from the unavailability, inconvenience or failures of the services or systems due to the following reasons: (i) system shut-down for maintenance; (ii) inability to transmit data due to failures in communications terminals or telecommunications equipment; (iii) systems failure and inability to perform its functions) due to force majeure events including but not limited to typhoons, earthquakes, tsunamis, floods, power failure, fires, storms, war, political unrest, labour strikes, shortage of labor or materials, riots, insurrections, civil disturbances, terrorist attack, explosions, acts of God, governmental actions, orders of domestic or foreign courts or tribunals, non-performance of third parties; or (iv) suspension or delay of services or systems failure due to reasons beyond the reasonable control of Alibaba.com such as hacker or cyber attacks, technical adjustments or failure of the telecommunications department, website upgrades, third party problems or any suspension or disruption of transportation or business operation (including but not limited to delays or disruption of the resumption of work or operation ordered by any government agency) in the event of a national or regional spread of epidemic or pandemic.",Alibaba,0
OTHERS,Intellectual Property Rights,Alibaba,0
OTHERS,libaba.com is the sole owner or lawful licensee of all the rights and interests in the Sites and the Site Content. The Sites and Site Content embody trade secrets and other intellectual property rights protected under worldwide copyright and other laws.,Alibaba,0
OTHERS,"All title, ownership and intellectual property rights in the Sites and Site Content shall remain with Alibaba.com, our affiliates or licensors, as the case may be.",Alibaba,0
OTHERS,All rights not otherwise claimed under the Terms or by Alibaba.com are hereby reserved.,Alibaba,0
OTHERS,"""ALIBABA"", ""ALIBABA.COM"" and related icons and logos are registered trademarks or trademarks or service marks of Alibaba Group Holding Limited and“GOLD SUPPLIER”, ""TRUSTPASS"" and related icons and logos are registered trademarks or trademarks or service marks of Alibaba.com Limited and its affiliates, in various jurisdictions and are protected under applicable copyright, trademark and other proprietary rights laws.",Alibaba,0
PROHIBITION,"The unauthorized copying, modification, use or publication of these marks is strictly prohibited.",Alibaba,2
PERMISSION,"Alibaba.com may have independent third parties involved in the provision of the Alibaba.com Sites or Services (e.g., the authentication and verification service providers).",Alibaba,1
PROHIBITION,"You may not use any trademark, service mark or logo of such independent third parties without prior written approval from such parties.",Alibaba,2
PERMISSION,"To the largest extent permissible under applicable law, all rights, title and interest to all derivative work created by Alibaba.com and/or its affiliates using User Content pursuant to the Terms shall belong to Alibaba.com, which may be freely assignable, licensable or grantable by Alibaba.com to any third party or its affiliates.",Alibaba,1
OTHERS,Notices,Alibaba,0
OTHERS,"All legal notices or demands to or upon Alibaba.com shall be made in writing and sent to Alibaba.com personally, by courier or certified mail to the following entity and address: Alibaba.com Hong Kong Limited/Alibaba.com Singapore E-Commerce Private Limited/Hangzhou Alibaba Advertising Co. Ltd (as the case maybe), 26/F Tower One, Times Square, 1 Matheson Street, Causeway Bay, Hong Kong, Attn: Legal Department. The notices shall be effective when they are received by Alibaba.com in the above-mentioned manner.",Alibaba,0
OTHERS,"All legal notices or demands to or upon a User shall be effective if either delivered personally, sent by courier, certified mail, by facsimile or email to the last-known correspondence, fax or email address provided by the User to Alibaba.com, or by posting such notice or demand on an area of the Sites that is publicly accessible without a charge.",Alibaba,0
OTHERS,"Notice to a User shall be deemed to be received by such User if and when: a) Alibaba.com is able to demonstrate that communication, whether in physical or electronic form, has been sent to such User, or b) immediately upon Alibaba.com posting such notice on an area of the Sites that is publicly accessible without charge.",Alibaba,0
DUTY,"You agree that all agreements, notices, demands, disclosures and other communications that Alibaba.com sends to you electronically will satisfy any legal requirement that such communication should be in writing.",Alibaba,3
OTHERS,General Provisions,Alibaba,0
OTHERS,"Subject to any Additional Agreements, the Terms constitute the entire agreement between you and Alibaba.com with respect to and govern your use of the Sites and Services, superseding any prior written or oral agreements in relation to the same subject matter herein",Alibaba,0
OTHERS,"Alibaba.com and you are independent contractors, and no agency, partnership, joint venture, employee-employer or franchiser-franchisee relationship is intended or created by the Terms.",Alibaba,0
OTHERS,"If any provision of the Terms is held to be invalid or unenforceable, such provision shall be deleted and the remaining provisions shall remain valid and be enforced.",Alibaba,0
OTHERS,"Headings are for reference purposes only and in no way define, limit, construe or describe the scope or extent of such clause.",Alibaba,0
OTHERS,Alibaba.com’s failure to enforce any right or failure to act with respect to any breach by you under the Terms will not constitute a waiver of that right nor a waiver of Alibaba.com’s right to act with respect to subsequent or similar breaches.,Alibaba,0
PERMISSION,"Alibaba.com shall have the right to assign the Terms (including all of our rights, titles, benefits, interests, and obligations and duties in the Terms to any person or entity (including any affiliates of Alibaba.com).",Alibaba,1
PROHIBITION,"You may not assign, in whole or part, the Terms to any person or entity.",Alibaba,2
OTHERS,THIS AGREEMENT SHALL BE GOVERNED BY THE LAWS OF THE PEOPLE’S REPUBLIC OF CHINA (“PRC”).,Alibaba,0
OTHERS,"IF YOU CONTRACT WITH HANGZHOU ALIBABA ADVERTISING CO., LTD ACCORDING TO PARAGRAPH 2.1, AND THE PARTIES TO THIS AGREEMENT HEREBY SUBMIT TO THE EXCLUSIVE JURISDICTION OF THE YUHANG BASIC PEOPLE’S COURT OF HANGZHOU, PRC.",Alibaba,0
OTHERS,"IF YOUR CONTRACT IS WITH ALIBABA.COM HONG KONG LIMITED OR ALIBABA.COM SINGAPORE E-COMMERCE PRIVATE LIMITED, THEN THIS AGREEMENT SHALL BE GOVERNED BY LAWS OF THE HONG KONG SPECIAL ADMINISTRATIVE REGION (""HONG KONG"") WITHOUT REGARD TO ITS CONFLICT OF LAW PROVISIONS.",Alibaba,0
DUTY,"THE PARTIES TO THIS AGREEMENT HEREBY SUBMIT TO THE EXCLUSIVE JURISDICTION OF THE HONG KONG COURTS, EXCEPT AS OTHERWISE STIPULATED UNDER APPLICABLE LAW.",Alibaba,3
PERMISSION,"If you have any comments on the Services we provide to you, you may contact our customer service support line (https://service.alibaba.com/buyer?spm=a2700.8293689.0.0.643f65aasdVUJy&tracelog=footer_hp_buyer) with any such feedback or questions.",Alibaba,1
OTHERS,"This is an agreement between you and Amazon Digital Services LLC (with its affiliates, “Amazon” or “we”).",Amazon,0
