CLASSES,SENTENCES,PROVIDER,VALUE
OTHERS,"If you don’t provide Academia.edu with an Arbitration Opt-out Notice within the thirty (30) day period, you will be deemed to have knowingly and intentionally waived your right to litigate any Dispute except for Litigable Actions.",AcademiaInc,0
OTHERS,"The exclusive jurisdiction and venue of any IP Protection Action or, if you timely provide Academia.edu with an Arbitration Opt-out Notice, any Dispute other than an individual action brought in small claims court, will be the state and federal courts located in the Northern District of California and each of the parties hereto waives any objection to jurisdiction and venue in such courts.",AcademiaInc,0
DUTY,"Unless you timely provide CIR with an Arbitration Opt-out Notice, you acknowledge and agree that you and Academia.edu are each waiving the right to a trial by jury or to participate as a plaintiff or class member in any purported class action or representative proceeding.",AcademiaInc,3
PROHIBITION,"Further, unless both you and Academia.edu otherwise agree in writing, the arbitrator may not consolidate more than one person's claims, and may not otherwise preside over any form of any class or representative proceeding.",AcademiaInc,2
OTHERS,"If this specific paragraph is held unenforceable, then the entirety of this “Dispute Resolution” section will be deemed void. Except as provided in the preceding sentence, this “Dispute Resolution” section will survive any termination of these Terms.",AcademiaInc,0
OTHERS,Arbitration Rules and Governing Law.,AcademiaInc,0
OTHERS,"The arbitration will be administered by the American Arbitration Association (“AAA”) in accordance with the Commercial Arbitration Rules and the Supplementary Procedures for Consumer Related Disputes (the “AAA Rules”) then in effect, except as modified by this “Dispute Resolution” section.",AcademiaInc,0
OTHERS,(The AAA Rules are available at www.adr.org/arb_med or by calling the AAA at 1-800-778-7879.),AcademiaInc,0
OTHERS,The Federal Arbitration Act will govern the interpretation and enforcement of this Section.,AcademiaInc,0
OTHERS,Arbitration Process.,AcademiaInc,0
DUTY,A party who desires to initiate arbitration must provide the other party with a written Demand for Arbitration as specified in the AAA Rules.,AcademiaInc,3
OTHERS,(The AAA provides a form Demand for Arbitration at http://www.adr.org/aaa/ShowPDF?doc=ADRSTG_004175 and a separate form for California residents at http://www.adr.org/aaa/ShowPDF?doc=ADRSTG_015822.),AcademiaInc,0
OTHERS,The arbitrator will be either a retired judge or an attorney licensed to practice law and will be selected by the parties from the AAA’s roster of arbitrators.,AcademiaInc,0
OTHERS,"If the parties are unable to agree upon an arbitrator within seven (7) days of delivery of the Demand for Arbitration, then the AAA will appoint the arbitrator in accordance with the AAA Rules.",AcademiaInc,0
OTHERS,Arbitration Location and Procedure.,AcademiaInc,0
OTHERS,"Unless you and Academia.edu otherwise agree, the arbitration will be conducted in the county where you reside.",AcademiaInc,0
OTHERS,"If your claim does not exceed $10,000, then the arbitration will be conducted solely on the basis of the documents that you and Academia.edu submit to the arbitrator, unless you request a hearing or the arbitrator determines that a hearing is necessary.",AcademiaInc,0
OTHERS,"If your claim exceeds $10,000, your right to a hearing will be determined by the AAA Rules.",AcademiaInc,0
OTHERS,"Subject to the AAA Rules, the arbitrator will have the discretion to direct a reasonable exchange of information by the parties, consistent with the expedited nature of the arbitration.",AcademiaInc,0
OTHERS,Arbitrator’s Decision.,AcademiaInc,0
OTHERS,The arbitrator will render an award within the time frame specified in the AAA Rules. The arbitrator’s decision will include the essential findings and conclusions upon which the arbitrator based the award,AcademiaInc,0
PERMISSION,Judgment on the arbitration award may be entered in any court having jurisdiction thereof.,AcademiaInc,1
DUTY,The arbitrator’s award damages must be consistent with the terms of the “Limitation of Liability” section above as to the types and the amounts of damages for which a party may be held liable.,AcademiaInc,3
PERMISSION,The arbitrator may award declaratory or injunctive relief only in favor of the claimant and only to the extent necessary to provide relief warranted by the claimant’s individual claim.,AcademiaInc,1
OTHERS,"If you prevail in arbitration you will be entitled to an award of attorneys’ fees and expenses, to the extent provided under applicable law.",AcademiaInc,0
OTHERS,"Academia.edu will not seek, and hereby waives all rights it may have under applicable law to recover, attorneys’ fees and expenses if it prevails in arbitration.",AcademiaInc,0
OTHERS,Fees.,AcademiaInc,0
OTHERS,"Your responsibility to pay any AAA filing, administrative and arbitrator fees will be solely as set forth in the AAA Rules.",AcademiaInc,0
OTHERS,"However, if your claim for damages does not exceed $75,000, Academia.edu will pay all such fees unless the arbitrator finds that either the substance of your claim or the relief sought in your Demand for Arbitration was frivolous or was brought for an improper purpose (as measured by the standards set forth in Federal Rule of Civil Procedure 11(b)).",AcademiaInc,0
OTHERS,Changes.,AcademiaInc,0
PERMISSION,"Notwithstanding the provisions of the “Modification” section above, if Academia.edu changes this “Dispute Resolution” section after the date you first accepted these Terms (or accepted any subsequent changes to these Terms), you may reject any such change by sending us written notice (including by email to feedback@academia.edu) within 30 days of the date such change became effective, as indicated in the “Last Updated Date” above or in the date of Academia.edu’s email to you notifying you of such change.",AcademiaInc,1
DUTY,"By rejecting any change, you are agreeing that you will arbitrate any Dispute between you and Academia.edu in accordance with the provisions of this “Dispute Resolution” section as of the date you first accepted these Terms (or accepted any subsequent changes to these Terms).",AcademiaInc,3
OTHERS,General,AcademiaInc,0
OTHERS,The failure of Academia.edu to enforce any right or provision of these Terms will not constitute a waiver of future enforcement of that right or provision. The waiver of any such right or provision will be effective only if in writing and signed by a duly authorized representative of Academia.edu.,AcademiaInc,0
OTHERS,"Except as expressly set forth in these Terms, the exercise by either party of any of its remedies under these Terms will be without prejudice to its other remedies under these Terms or otherwise.",AcademiaInc,0
OTHERS,"If for any reason a court of competent jurisdiction finds any provision of these Terms invalid or unenforceable, that provision will be enforced to the maximum extent permissible and the other provisions of these Terms will remain in full force and effect.",AcademiaInc,0
OTHERS,Contacting Academia.edu,AcademiaInc,0
DUTY,"If you have any questions about these Terms, please contact Academia.edu at feedback@academia.edu.",AcademiaInc,3
OTHERS,Legal terms,Airbnb,0
OTHERS,Terms of Service,Airbnb,0
OTHERS,"If your country of residence or establishment is within the European Economic Area (“EEA”), Switzerland or the United Kingdom, the Terms of Service for European Users apply to you.",Airbnb,0
OTHERS,"If your country of residence or establishment is outside of the EEA, Switzerland, and the United Kingdom, the Terms of Service for Non-European Users apply to you.",Airbnb,0
OTHERS,Terms of Service for Non-European Users,Airbnb,0
OTHERS,Section 23 of these Terms contains an arbitration agreement and class action waiver that apply to all claims brought against Airbnb in the United States. Please read them carefully.,Airbnb,0
OTHERS,"Last Updated: February 10, 2022",Airbnb,0
OTHERS,Thank you for using Airbnb!,Airbnb,0
OTHERS,"These Terms of Service (“Terms”) are a binding legal agreement between you and Airbnb that govern your right to use the websites, applications, and other offerings from Airbnb (collectively, the “Airbnb Platform”).",Airbnb,0
OTHERS,"When used in these Terms, “Airbnb,” “we,” “us,” or “our” refers to the Airbnb entity set out on Schedule 1 with whom you are contracting.",Airbnb,0
OTHERS,"The Airbnb Platform offers an online venue that enables users (“Members”) to publish, offer, search for, and book services. Members who publish and offer services are “Hosts” and Members who search for, book, or use services are “Guests.”",Airbnb,0
OTHERS,"Hosts offer accommodations (“Accommodations”), activities, excursions, and events (“Experiences”), and a variety of travel and other services (collectively, “Host Services,” and each Host Service offering, a “Listing”).",Airbnb,0
DUTY,"You must register an account to access and use many features of the Airbnb Platform, and must keep your account information accurate.",Airbnb,3
OTHERS,"As the provider of the Airbnb Platform, Airbnb does not own, control, offer or manage any Listings or Host Services.",Airbnb,0
OTHERS,"Airbnb is not a party to the contracts entered into directly between Hosts and Guests, nor is Airbnb a real estate broker, travel agency, or insurer. Airbnb is not acting as an agent in any capacity for any Member, except as specified in the Payments Terms of Service (“Payment Terms”).",Airbnb,0
OTHERS,To learn more about Airbnb’s role see Section 16.,Airbnb,0
OTHERS,"We maintain other terms and policies that supplement these Terms like our Privacy Policy, which describes our collection and use of personal data, and our Payments Terms, which govern any payment services provided to Members by the Airbnb payment entities (collectively ""Airbnb Payments"").",Airbnb,0
DUTY,"If you are a Host, you are responsible for understanding and complying with all laws, rules, regulations and contracts with third parties that apply to your Host Services.",Airbnb,3
OTHERS,Guest Terms,Airbnb,0
OTHERS,Our Mission.,Airbnb,0
OTHERS,Our mission is to create a world where you can belong anywhere.,Airbnb,0
OTHERS,"From cabins to castles to cooking classes, browse through millions of Listings to find the ones that fit the way you like to travel.",Airbnb,0
OTHERS,"Learn more about a Listing by reviewing the description and photos, the Host profile, and Guest reviews.",Airbnb,0
OTHERS,"If you have questions, just message the Host.",Airbnb,0
OTHERS,Searching and Booking on Airbnb.,Airbnb,0
OTHERS,Searching.,Airbnb,0
PERMISSION,"You can search for Host Services by using criteria like the type of Host Service, travel destination, travel dates, and number of guests.",Airbnb,1
PERMISSION,You can also use filters to refine your search results. Search results are based on their relevance to your search and other criteria.,Airbnb,1
OTHERS,"Relevance considers factors like price, availability, Reviews, customer service and cancellation history, popularity, previous trips and saved Listings, Host requirements (e.g. minimum or maximum nights), and more.",Airbnb,0
OTHERS,Learn more about search results in our Help Center.,Airbnb,0
OTHERS,Booking.,Airbnb,0
DUTY,"When you book a Listing, you are agreeing to pay all charges for your booking including the Listing price, applicable fees like Airbnb’s service fee, offline fees, taxes, and any other items identified during checkout (collectively, “Total Price”).",Airbnb,3
DUTY,You are also agreeing that Airbnb via Airbnb Payments may charge the Payment Method (as defined in the Payment Terms) used to book the Listing in order to collect Damage Claim (as defined in Section 15) amounts.,Airbnb,3
OTHERS,"When you receive the booking confirmation, a contract for Host Services (a ""Reservation"") is formed directly between you and the Host.",Airbnb,0
DUTY,"In addition to these Terms, you will be subject to, and responsible for complying with, all terms of the Reservation, including without limitation, the cancellation policy and any other rules, standards, policies, or requirements identified in the Listing or during checkout that apply to the Reservation.",Airbnb,3
DUTY,"It is your responsibility to read and understand these rules, standards, policies, and requirements prior to booking a Listing.",Airbnb,3
OTHERS,Be aware that some Hosts work with a co-host or as part of a team to provide their Host Services.,Airbnb,0
OTHERS,Accommodation Reservations.,Airbnb,0
OTHERS,"An Accommodation Reservation is a limited license to enter, occupy, and use the Accommodation.",Airbnb,0
PERMISSION,"The Host retains the right to re-enter the Accommodation during your stay, to the extent: (i) it is reasonably necessary, (ii) permitted by your contract with the Host, and (iii) consistent with applicable law.",Airbnb,1
PERMISSION,"If you stay past checkout, the Host has the right to make you leave in a manner consistent with applicable law, including by imposing reasonable overstay penalties.",Airbnb,1
PERMISSION,You may not exceed the maximum number of allowed Guests.,Airbnb,1
OTHERS,Reservations for Experiences and Other Host Services.,Airbnb,0
OTHERS,"An Experience or other Host Service Reservation entitles you to participate in, attend, or use that Host Service.",Airbnb,0
DUTY,"You are responsible for confirming that you, and anyone you invite, meet minimum age, proficiency, fitness, or other requirements.",Airbnb,3
DUTY,"You are responsible for informing the Host of any medical or physical conditions, or other circumstances that may impact your ability to participate, attend, or use the Host Service.",Airbnb,3
PROHIBITION,"Except where expressly authorized, you may not allow any person to join a Host Service unless they are included as an additional guest during the booking process.",Airbnb,2
OTHERS,"Cancellations, Travel Issues, Refunds and Booking Modifications.",Airbnb,0
OTHERS,"Cancellations, Travel Issues, and Refunds.",Airbnb,0
OTHERS,"In general, if as a Guest you cancel a Reservation, the amount refunded to you is determined by the cancellation policy that applies to that Reservation.",Airbnb,0
OTHERS,"But, in certain situations, other policies take precedence and determine what amount is refunded to you.",Airbnb,0
PERMISSION,"If something outside your control forces you to cancel a Reservation, you may be eligible for a partial or full refund under our Extenuating Circumstances Policy.",Airbnb,1
PERMISSION,"If the Host cancels, or you experience a Travel Issue (as defined in our Guest Refund Policy), you may be eligible for rebooking assistance or a partial or full refund under the Guest Refund Policy.",Airbnb,1
OTHERS,Different policies apply to certain categories of Listings; for example Experiences Reservations are governed by the Experiences Guest Refund Policy.,Airbnb,0
OTHERS,"See each Additional Legal Term or Policy for details about what is covered, and what refund applies in each situation.",Airbnb,0
OTHERS,Booking Modifications.,Airbnb,0
DUTY,"Guests and Hosts are responsible for any booking modifications they agree to make via the Airbnb Platform or direct Airbnb customer service to make on their behalf (""Booking Modifications""), and agree to pay any additional amounts, fees, or taxes associated with any Booking Modification.",Airbnb,3
OTHERS,Your Responsibilities and Assumption of Risk.,Airbnb,0
OTHERS,Your Responsibilities.,Airbnb,0
DUTY,"You are responsible and liable for your own acts and omissions and are also responsible for the acts and omissions of anyone you invite to join or provide access to any Accommodation, Experience or other Host Service.",Airbnb,3
DUTY,"For example, this means: (i) you are responsible for leaving an Accommodation (and related personal property) in the condition it was in when you arrived, (ii) you are responsible for paying all reasonable Damage Claim amounts necessary to cover damage that you, your guest(s), or your pet(s) cause to an Accommodation, and (iii) you must act with integrity, treat others with respect, and comply with applicable laws at all times.",Airbnb,3
DUTY,"If you are booking for an additional guest who is a minor or if you bring a minor to a Host Service, you must be legally authorized to act on behalf of the minor and you are solely responsible for the supervision of that minor.",Airbnb,3
OTHERS,Your Assumption of Risk.,Airbnb,0
DUTY,"You acknowledge that many activities carry inherent risks and agree that, to the maximum extent permitted by applicable law, you assume the entire risk arising out of your access to and use of the Airbnb Platform and any Content (as defined in Section 10), including your stay at any Accommodation, participation in any Experience, use of any other Host Service, or any other interaction you have with other Members whether in person or online.",Airbnb,3
DUTY,This means it is your responsibility to investigate a Host Service to determine whether it is suitable for you.,Airbnb,3
OTHERS,"For example, Host Services may carry risk of illness, bodily injury, disability, or death, and you freely and willfully assume those risks by choosing to participate in those Host Services.",Airbnb,0
OTHERS,Host Terms,Airbnb,0
OTHERS,Hosting on Airbnb.,Airbnb,0
OTHERS,Host.,Airbnb,0
PERMISSION,"As a Host, Airbnb offers you the right to use the Airbnb Platform to share your Accommodation, Experience, or other Host Service with our vibrant community of Guests - and earn money doing it.",Airbnb,1
PERMISSION,"It’s easy to create a Listing and you are in control of how you host - set your price, availability, and rules for each Listing.",Airbnb,1
OTHERS,Contracting with Guests.,Airbnb,0
DUTY,"When you accept a booking request, or receive a booking confirmation through the Airbnb Platform, you are entering into a contract directly with the Guest, and are responsible for delivering your Host Service under the terms and at the price specified in your Listing.",Airbnb,3
DUTY,You are also agreeing to pay applicable fees like Airbnb’s service fee (and applicable taxes) for each booking.,Airbnb,3
OTHERS,Airbnb Payments will deduct amounts you owe from your payout unless we and you agree to a different method.,Airbnb,0
DUTY,"Any terms, policies or conditions that you include in any supplemental contract with Guests must: (i) be consistent with these Terms, our Additional Legal Terms, Policies, and the information provided in your Listing, and (ii) be prominently disclosed in your Listing description.",Airbnb,3
OTHERS,Independence of Hosts.,Airbnb,0
OTHERS,"Your relationship with Airbnb is that of an independent individual or entity and not an employee, agent, joint venturer, or partner of Airbnb, except that Airbnb Payments acts as a payment collection agent as described in the Payments Terms.",Airbnb,0
DUTY,"Airbnb does not direct or control your Host Service, and you agree that you have complete discretion whether and when to provide Host Services, and at what price and on what terms to offer them.",Airbnb,3
OTHERS,Managing Your Listing.,Airbnb,0
OTHERS,Creating and Managing Your Listing.,Airbnb,0
OTHERS,The Airbnb Platform provides tools that make it easy for you to set up and manage a Listing.,Airbnb,0
DUTY,"Your Listing must include complete and accurate information about your Host Service, your price, other charges like cleaning fees, resort fees, offline fees, and any rules or requirements that apply to your Guests or Listing.",Airbnb,3
DUTY,You are responsible for keeping your Listing information (including calendar availability) and content (like photos) up-to-date and accurate at all times.,Airbnb,3
OTHERS,We recommend that you obtain appropriate insurance for your Host Services and suggest you carefully review policy terms and conditions including coverage details and exclusions.,Airbnb,0
PERMISSION,"You may only maintain one Listing per Accommodation, but may have multiple Listings for a single property if it has multiple places to stay.",Airbnb,1
OTHERS,Any offer of an Experience is subject to our Additional Terms for Experience Hosts.,Airbnb,0
OTHERS,Know Your Legal Obligations.,Airbnb,0
DUTY,"You are responsible for understanding and complying with any laws, rules, regulations, and contracts with third parties that apply to your Listing or Host Services.",Airbnb,3
OTHERS,"For example: Some landlords and leases, or homeowner and condominium association rules, restrict or prohibit subletting, short-term rentals and/or longer-term stays. Some cities have zoning or other laws that restrict the short-term rental of residential properties.",Airbnb,0
DUTY,"Some jurisdictions require Hosts to register, get a permit, or obtain a license before providing certain Host Services (such as short-term rentals, longer-term stays, preparing food, serving alcohol for sale, guiding tours, or operating a vehicle).",Airbnb,3
OTHERS,"In some places, the Host Services you want to offer may be prohibited altogether.",Airbnb,0
DUTY,Some jurisdictions require that you register Guests who stay at your Accommodation.,Airbnb,3
OTHERS,Some jurisdictions have laws that create tenancy rights for Guests and additional obligations for Hosts.,Airbnb,0
OTHERS,"For example, some places have landlord-tenant, rent control, and eviction laws that may apply to longer stays.",Airbnb,0
OTHERS,Check your local rules to learn what rules apply to the Host Services you plan to offer.,Airbnb,0
DUTY,Information we provide regarding legal requirements is for informational purposes only and you should independently confirm your obligations.,Airbnb,3
DUTY,"You are responsible for handling and using personal data of Guests and others in compliance with applicable privacy laws and these Terms, including our Host Privacy Standards.",Airbnb,3
DUTY,If you have questions about how local laws apply you should always seek legal advice.,Airbnb,3
OTHERS,Search Ranking.,Airbnb,0
OTHERS,"The ranking of Listings in search results on the Airbnb Platform depends on a variety of factors, including these main parameters: Guest search parameters (e.g. number of Guests, time and duration of the trip, price range), Listing characteristics (e.g. price, calendar availability, number and quality of images, Reviews, type of Host Service, Host status, age of the Listing, average Guest popularity), Guest booking experience (e.g. customer service and cancellation history of the Host, ease of booking), Host requirements (e.g. minimum or maximum nights, booking cut-off time), and Guest preferences (e.g. previous trips, saved Listings, location from where the Guest is searching).",Airbnb,0
OTHERS,Search results may appear different on our mobile application than they appear on our website.,Airbnb,0
PERMISSION,Airbnb may allow Hosts to promote their Listings in search or elsewhere on the Airbnb Platform by paying an additional fee.,Airbnb,1
OTHERS,"More information about the factors that determine how your Listing appears in search results, our current promotional programs (if any), and how we identify promoted Content can be found in our Help Center.",Airbnb,0
OTHERS,Your Responsibilities.,Airbnb,0
DUTY,You are responsible and liable for your own acts and omissions and are also responsible for the acts and omissions of anyone you allow to participate in providing your Host Services.,Airbnb,3
DUTY,You are responsible for setting your price and establishing rules and requirements for your Listing.,Airbnb,3
DUTY,You must describe any and all fees and charges in your Listing description.,Airbnb,3
PROHIBITION,You may not collect any additional fees or charges outside the Airbnb Platform except those expressly authorized by our Offline Fee Policy.,Airbnb,2
PROHIBITION,"Do not encourage Guests to create third-party accounts, submit reviews, provide their contact information, or take other actions outside the Airbnb Platform in violation of our Off-Platform Policy.",Airbnb,2
OTHERS,Hosting as a Team or Organization.,Airbnb,0
DUTY,"If you work with a co-host or host as part of a team, business, or other organization, the entity and each individual who participates in providing Host Services is responsible and liable as a Host under these Terms.",Airbnb,3
DUTY,"If you accept terms or enter into contracts, you represent and warrant that you are authorized to enter into contracts for and bind your team, business or other organization, and that each entity you use is in good standing under the laws of the place where it is established.",Airbnb,3
DUTY,"If you perform other functions, you represent and warrant that you are authorized to perform those functions.",Airbnb,3
DUTY,"If you instruct Airbnb to transfer a portion of your payout to a co-host or other Hosts, or to send payments to someone else, you must be authorized to do so, and are responsible and liable for the payment amounts and accuracy of any payout information you provide.",Airbnb,3
OTHERS,Your Assumption of Risk.,Airbnb,0
DUTY,"You acknowledge that hosting carries inherent risks and agree that you assume the entire risk arising out of your access to and use of the Airbnb Platform, offering Host Services, or any interaction you have with other Members whether in person or online.",Airbnb,3
DUTY,"You agree that you have had the opportunity to investigate the Airbnb Platform and any laws, rules, regulations, or obligations that may be applicable to your Listings or Host Services and that you are not relying upon any statement of law made by Airbnb.",Airbnb,3
OTHERS,"Cancellations, Travel Issues, and Booking Modifications.",Airbnb,0
OTHERS,Cancellations and Travel Issues.,Airbnb,0
